{"case_id":"contract-fixture","created_at":"2026-09-08T00:00:00Z","files":[{"input_id":"problem","path":"problem.txt","readonly":true,"role":"problem","sha256":"0c3e76ff4f9d4ad67976e091e5bd5dae493f3b8b81b7e4586d7e4bc14fc69c64","size_bytes":69,"source":{"accessed_at":"2026-09-08T00:00:00Z","license":"Repository-authored synthetic fixture","uri":"fixture://synthetic-contract-example"}}],"frozen":true,"producer":"preflight","schema_version":"2.0"}
